{
 "version": "block-2",
 "revision": 1,
 "fighter_id": "tpl_tai_chi",
 "name": "Tai Chi (push hands) template",
 "combat_identity": "Tai Chi (push hands) starter build (rename and customize)",
 "dimensions": {
  "hands": "hands.long_guard",
  "defense": "defense.parry_catch",
  "stance": "stance.balanced",
  "tie": null,
  "target": "target.mixer",
  "kicking": "kicking.none",
  "mentality": "mentality.counter"
 },
 "adaptation": "mma",
 "orientation": "orthodox",
 "slot_count": 2,
 "slot_label": "Two-piece",
 "synchronized_capabilities": [
  {
   "id": "tpl_tai_chi.slot.1",
   "capabilities": [
    "tai_chi"
   ],
   "description": "Waits, redirects the attack, then uproots with fa jin.",
   "trigger": "fight_start",
   "sequence": [
    "deflect_parry_punch",
    "brush_knee_palm",
    "fa_jin_push"
   ],
   "home_range": "punch",
   "goal": "counter_trap",
   "abandon_rule": {
    "max_consecutive_stalls": 2,
    "condition": "sequence_denied_or_countered"
   },
   "links": [
    "tpl_tai_chi.slot.2"
   ]
  },
  {
   "id": "tpl_tai_chi.slot.2",
   "capabilities": [
    "anti_grappling"
   ],
   "description": "Breaks grips, sprawls or whizzers, and gets back to range.",
   "trigger": "opponent_clinches_or_shoots",
   "sequence": [
    "clinch_break",
    "pivot",
    "retreat"
   ],
   "home_range": "punch",
   "goal": "reset_to_home_range",
   "abandon_rule": {
    "max_consecutive_stalls": 2,
    "condition": "clinch_denied_or_escaped"
   },
   "links": [
    "tpl_tai_chi.slot.1"
   ]
  }
 ],
 "baseline_capabilities": [
  "basic_movement",
  "untrained_striking"
 ],
 "tempo": 2,
 "preferred_ranges": [
  "punch",
  "close"
 ],
 "debt_sentence": "Tai Chi (push hands) template: every option's weakness is listed in exploitable_seams.",
 "exploitable_seams": [
  "debt.defense.parry_catch.body",
  "debt.defense.parry_catch.head_hook",
  "debt.hands.long_guard.body",
  "debt.hands.long_guard.clinch",
  "debt.kicking.none.body",
  "debt.kicking.none.leg",
  "debt.mentality.counter.tempo",
  "debt.mentality.counter.wall",
  "debt.stance.balanced.head_straight",
  "debt.stance.balanced.tempo",
  "debt.target.mixer.recovery",
  "debt.target.mixer.tempo"
 ],
 "active_techniques": [
  "step",
  "retreat",
  "pivot",
  "feint",
  "deflect_parry_punch",
  "brush_knee_palm",
  "fa_jin_push",
  "clinch_break",
  "push_hands_redirect",
  "parry"
 ],
 "signature_moves": [
  "push_hands_redirect",
  "fa_jin_push"
 ],
 "airborne_training": {
  "allowed_vertical_modes": [
   "grounded"
  ],
  "techniques": []
 },
 "conditional_abilities": [],
 "combat_limitations": [
  "Template card for Tai Chi (push hands): replace with the character's own limitations."
 ],
 "fighting_description": {
  "does": "Waits, redirects the attack, then uproots with fa jin.",
  "wins": "By the style's signature tools (see signature_moves).",
  "avoids": "Fighting outside its home range.",
  "beaten_by": "Opponents who exploit its listed seams."
 },
 "appearance": {
  "clothing": "TBD",
  "identity_anchor": "TBD",
  "props": []
 },
 "provenance": {
  "classification": "CANON",
  "note": "style template from the v2.1 handoff; rename and customize before use"
 }
}
