{
 "version": "block-2",
 "revision": 1,
 "fighter_id": "tpl_baguazhang",
 "name": "Baguazhang template",
 "combat_identity": "Baguazhang starter build (rename and customize)",
 "dimensions": {
  "hands": "hands.long_guard",
  "defense": "defense.outfight",
  "stance": "stance.shuffle",
  "tie": null,
  "target": "target.mixer",
  "kicking": "kicking.none",
  "mentality": "mentality.slickster"
 },
 "adaptation": "mma",
 "orientation": "orthodox",
 "slot_count": 2,
 "slot_label": "Two-piece",
 "synchronized_capabilities": [
  {
   "id": "tpl_baguazhang.slot.1",
   "capabilities": [
    "baguazhang"
   ],
   "description": "Circles to the outside, palms from the new angle, turns them to the floor.",
   "trigger": "fight_start",
   "sequence": [
    "circle_walk",
    "single_palm_change",
    "piercing_palm",
    "turning_throw",
    "foot_sweep"
   ],
   "home_range": "punch",
   "goal": "head_damage",
   "abandon_rule": {
    "max_consecutive_stalls": 2,
    "condition": "sequence_denied_or_countered"
   },
   "links": [
    "tpl_baguazhang.slot.2"
   ]
  },
  {
   "id": "tpl_baguazhang.slot.2",
   "capabilities": [
    "anti_grappling"
   ],
   "description": "Breaks grips, sprawls or whizzers, and gets back to range.",
   "trigger": "opponent_clinches_or_shoots",
   "sequence": [
    "clinch_break",
    "pivot",
    "retreat"
   ],
   "home_range": "punch",
   "goal": "reset_to_home_range",
   "abandon_rule": {
    "max_consecutive_stalls": 2,
    "condition": "clinch_denied_or_escaped"
   },
   "links": [
    "tpl_baguazhang.slot.1"
   ]
  }
 ],
 "baseline_capabilities": [
  "basic_movement",
  "untrained_striking"
 ],
 "tempo": 3,
 "preferred_ranges": [
  "punch"
 ],
 "debt_sentence": "Baguazhang template: every option's weakness is listed in exploitable_seams.",
 "exploitable_seams": [
  "debt.defense.outfight.tempo",
  "debt.defense.outfight.wall",
  "debt.hands.long_guard.body",
  "debt.hands.long_guard.clinch",
  "debt.kicking.none.body",
  "debt.kicking.none.leg",
  "debt.mentality.slickster.head_straight",
  "debt.mentality.slickster.wall",
  "debt.stance.shuffle.single_support",
  "debt.stance.shuffle.tempo",
  "debt.target.mixer.recovery",
  "debt.target.mixer.tempo"
 ],
 "active_techniques": [
  "step",
  "retreat",
  "pivot",
  "feint",
  "circle_walk",
  "single_palm_change",
  "piercing_palm",
  "turning_throw",
  "foot_sweep",
  "clinch_break",
  "parry"
 ],
 "signature_moves": [
  "circle_walk",
  "single_palm_change",
  "turning_throw"
 ],
 "airborne_training": {
  "allowed_vertical_modes": [
   "grounded"
  ],
  "techniques": []
 },
 "conditional_abilities": [],
 "combat_limitations": [
  "Template card for Baguazhang: replace with the character's own limitations."
 ],
 "fighting_description": {
  "does": "Circles to the outside, palms from the new angle, turns them to the floor.",
  "wins": "By the style's signature tools (see signature_moves).",
  "avoids": "Fighting outside its home range.",
  "beaten_by": "Opponents who exploit its listed seams."
 },
 "appearance": {
  "clothing": "TBD",
  "identity_anchor": "TBD",
  "props": []
 },
 "provenance": {
  "classification": "CANON",
  "note": "style template from the v2.1 handoff; rename and customize before use"
 }
}
