{
 "version": "block-2",
 "revision": 1,
 "fighter_id": "tpl_hung_gar",
 "name": "Hung Gar template",
 "combat_identity": "Hung Gar starter build (rename and customize)",
 "dimensions": {
  "hands": "hands.high_guard",
  "defense": "defense.block_absorb",
  "stance": "stance.planted",
  "tie": null,
  "target": "target.head_hunter",
  "kicking": "kicking.none",
  "mentality": "mentality.pressure"
 },
 "adaptation": "mma",
 "orientation": "orthodox",
 "slot_count": 2,
 "slot_label": "Two-piece",
 "synchronized_capabilities": [
  {
   "id": "tpl_hung_gar.slot.1",
   "capabilities": [
    "hung_gar"
   ],
   "description": "Rooted stance, bridge-arm smashes through the guard, tiger claws and no-shadow kicks.",
   "trigger": "fight_start",
   "sequence": [
    "bridge_smash",
    "tiger_claw",
    "cross",
    "hook",
    "no_shadow_kick"
   ],
   "home_range": "punch",
   "goal": "head_damage",
   "abandon_rule": {
    "max_consecutive_stalls": 2,
    "condition": "sequence_denied_or_countered"
   },
   "links": [
    "tpl_hung_gar.slot.2"
   ]
  },
  {
   "id": "tpl_hung_gar.slot.2",
   "capabilities": [
    "anti_grappling"
   ],
   "description": "Breaks grips, sprawls or whizzers, and gets back to range.",
   "trigger": "opponent_clinches_or_shoots",
   "sequence": [
    "clinch_break",
    "pivot",
    "retreat"
   ],
   "home_range": "punch",
   "goal": "reset_to_home_range",
   "abandon_rule": {
    "max_consecutive_stalls": 2,
    "condition": "clinch_denied_or_escaped"
   },
   "links": [
    "tpl_hung_gar.slot.1"
   ]
  }
 ],
 "baseline_capabilities": [
  "basic_movement",
  "untrained_striking"
 ],
 "tempo": 3,
 "preferred_ranges": [
  "punch"
 ],
 "debt_sentence": "Hung Gar template: every option's weakness is listed in exploitable_seams.",
 "exploitable_seams": [
  "debt.defense.block_absorb.body",
  "debt.defense.block_absorb.vision",
  "debt.hands.high_guard.body",
  "debt.hands.high_guard.vision",
  "debt.kicking.none.body",
  "debt.kicking.none.leg",
  "debt.mentality.pressure.angle",
  "debt.mentality.pressure.body",
  "debt.stance.planted.angle",
  "debt.stance.planted.leg",
  "debt.target.head_hunter.body",
  "debt.target.head_hunter.entry"
 ],
 "active_techniques": [
  "step",
  "retreat",
  "pivot",
  "feint",
  "bridge_smash",
  "tiger_claw",
  "cross",
  "hook",
  "no_shadow_kick",
  "clinch_break",
  "shell_block",
  "parry",
  "body_hook",
  "low_kick"
 ],
 "signature_moves": [
  "tiger_claw",
  "no_shadow_kick",
  "bridge_smash"
 ],
 "airborne_training": {
  "allowed_vertical_modes": [
   "grounded"
  ],
  "techniques": []
 },
 "conditional_abilities": [],
 "combat_limitations": [
  "Template card for Hung Gar: replace with the character's own limitations."
 ],
 "fighting_description": {
  "does": "Rooted stance, bridge-arm smashes through the guard, tiger claws and no-shadow kicks.",
  "wins": "By the style's signature tools (see signature_moves).",
  "avoids": "Fighting outside its home range.",
  "beaten_by": "Opponents who exploit its listed seams."
 },
 "appearance": {
  "clothing": "TBD",
  "identity_anchor": "TBD",
  "props": []
 },
 "provenance": {
  "classification": "CANON",
  "note": "style template from the v2.1 handoff; rename and customize before use"
 }
}
