{
 "version": "block-2",
 "revision": 1,
 "fighter_id": "tpl_jeet_kune_do",
 "name": "Jeet Kune Do template",
 "combat_identity": "Jeet Kune Do starter build (rename and customize)",
 "dimensions": {
  "hands": "hands.long_guard",
  "defense": "defense.parry_catch",
  "stance": "stance.bladed",
  "tie": null,
  "target": "target.head_hunter",
  "kicking": "kicking.karate",
  "mentality": "mentality.technician"
 },
 "adaptation": "mma",
 "orientation": "southpaw",
 "laterality": {
  "dominant_hand": "right",
  "dominant_leg": "right",
  "opposite_stance_experience": "high"
 },
 "slot_count": 2,
 "slot_label": "Two-piece",
 "synchronized_capabilities": [
  {
   "id": "tpl_jeet_kune_do.slot.1",
   "capabilities": [
    "jeet_kune_do"
   ],
   "description": "Intercepts with the strong-side lead, stop kicks, traps into the straight blast.",
   "trigger": "fight_start",
   "sequence": [
    "lead_straight_intercept",
    "oblique_kick",
    "pak_sao",
    "chain_punch",
    "side_kick"
   ],
   "home_range": "punch",
   "goal": "counter_trap",
   "abandon_rule": {
    "max_consecutive_stalls": 2,
    "condition": "sequence_denied_or_countered"
   },
   "links": [
    "tpl_jeet_kune_do.slot.2"
   ]
  },
  {
   "id": "tpl_jeet_kune_do.slot.2",
   "capabilities": [
    "boxing"
   ],
   "description": "Boxing when the interception game stalls.",
   "trigger": "slot_stalled",
   "sequence": [
    "jab",
    "cross",
    "hook",
    "uppercut"
   ],
   "home_range": "punch",
   "goal": "head_damage",
   "abandon_rule": {
    "max_consecutive_stalls": 2,
    "condition": "sequence_denied_or_countered"
   },
   "links": [
    "tpl_jeet_kune_do.slot.1"
   ]
  }
 ],
 "baseline_capabilities": [
  "basic_movement",
  "untrained_striking"
 ],
 "tempo": 3,
 "preferred_ranges": [
  "punch",
  "kick"
 ],
 "debt_sentence": "Jeet Kune Do template: every option's weakness is listed in exploitable_seams.",
 "exploitable_seams": [
  "debt.defense.parry_catch.body",
  "debt.defense.parry_catch.head_hook",
  "debt.hands.long_guard.body",
  "debt.hands.long_guard.clinch",
  "debt.kicking.karate.leg",
  "debt.kicking.karate.single_support",
  "debt.mentality.technician.clinch",
  "debt.mentality.technician.wall",
  "debt.stance.bladed.entry",
  "debt.stance.bladed.leg",
  "debt.target.head_hunter.body",
  "debt.target.head_hunter.entry"
 ],
 "active_techniques": [
  "step",
  "retreat",
  "pivot",
  "feint",
  "lead_straight_intercept",
  "oblique_kick",
  "pak_sao",
  "chain_punch",
  "side_kick",
  "jab",
  "cross",
  "hook",
  "uppercut",
  "finger_jab",
  "parry",
  "slip"
 ],
 "signature_moves": [
  "lead_straight_intercept",
  "finger_jab",
  "oblique_kick"
 ],
 "airborne_training": {
  "allowed_vertical_modes": [
   "grounded"
  ],
  "techniques": []
 },
 "conditional_abilities": [],
 "combat_limitations": [
  "Template card for Jeet Kune Do: replace with the character's own limitations."
 ],
 "fighting_description": {
  "does": "Intercepts with the strong-side lead, stop kicks, traps into the straight blast.",
  "wins": "By the style's signature tools (see signature_moves).",
  "avoids": "Fighting outside its home range.",
  "beaten_by": "Opponents who exploit its listed seams."
 },
 "appearance": {
  "clothing": "TBD",
  "identity_anchor": "TBD",
  "props": []
 },
 "provenance": {
  "classification": "CANON",
  "note": "style template from the v2.1 handoff; rename and customize before use"
 }
}
