{
 "version": "block-2",
 "revision": 1,
 "fighter_id": "tpl_taekwondo",
 "name": "Taekwondo template",
 "combat_identity": "Taekwondo starter build (rename and customize)",
 "dimensions": {
  "hands": "hands.hands_down",
  "defense": "defense.outfight",
  "stance": "stance.bladed",
  "tie": "tie.anti_grappling",
  "target": "target.head_hunter",
  "kicking": "kicking.karate",
  "mentality": "mentality.outboxer"
 },
 "adaptation": "mma",
 "orientation": "orthodox",
 "slot_count": 3,
 "slot_label": "Triad",
 "synchronized_capabilities": [
  {
   "id": "tpl_taekwondo.slot.1",
   "capabilities": [
    "taekwondo"
   ],
   "description": "Long-range kicking: cut kicks to stop entries, fast roundhouses, head kicks.",
   "trigger": "fight_start",
   "sequence": [
    "cut_kick",
    "fast_roundhouse",
    "instep_head_kick",
    "side_kick",
    "spinning_back_kick"
   ],
   "home_range": "kick",
   "goal": "head_damage",
   "abandon_rule": {
    "max_consecutive_stalls": 2,
    "condition": "kicks_blocked_or_jammed"
   },
   "links": [
    "tpl_taekwondo.slot.2",
    "tpl_taekwondo.slot.3"
   ]
  },
  {
   "id": "tpl_taekwondo.slot.2",
   "capabilities": [
    "taekwondo",
    "switch_step"
   ],
   "description": "Switches stance into spinning and jumping finishers when the opponent is hurt.",
   "trigger": "opponent_hurt",
   "sequence": [
    "switch_step",
    "double_roundhouse",
    "tornado_kick",
    "jumping_back_kick"
   ],
   "home_range": "kick",
   "goal": "head_damage",
   "abandon_rule": {
    "max_consecutive_stalls": 2,
    "condition": "sequence_denied_or_countered"
   },
   "links": [
    "tpl_taekwondo.slot.1",
    "tpl_taekwondo.slot.3"
   ]
  },
  {
   "id": "tpl_taekwondo.slot.3",
   "capabilities": [
    "anti_grappling"
   ],
   "description": "Breaks grips, sprawls or whizzers, and gets back to range.",
   "trigger": "opponent_clinches_or_shoots",
   "sequence": [
    "clinch_break",
    "pivot",
    "retreat"
   ],
   "home_range": "kick",
   "goal": "reset_to_home_range",
   "abandon_rule": {
    "max_consecutive_stalls": 2,
    "condition": "clinch_denied_or_escaped"
   },
   "links": [
    "tpl_taekwondo.slot.1"
   ]
  }
 ],
 "baseline_capabilities": [
  "basic_movement",
  "untrained_striking"
 ],
 "tempo": 3,
 "preferred_ranges": [
  "kick",
  "outside"
 ],
 "debt_sentence": "Taekwondo template: every option's weakness is listed in exploitable_seams.",
 "exploitable_seams": [
  "debt.defense.outfight.tempo",
  "debt.defense.outfight.wall",
  "debt.hands.hands_down.head_hook",
  "debt.hands.hands_down.head_straight",
  "debt.kicking.karate.leg",
  "debt.kicking.karate.single_support",
  "debt.mentality.outboxer.tempo",
  "debt.mentality.outboxer.wall",
  "debt.stance.bladed.entry",
  "debt.stance.bladed.leg",
  "debt.target.head_hunter.body",
  "debt.target.head_hunter.entry",
  "debt.tie.anti_grappling.head_straight",
  "debt.tie.anti_grappling.tempo"
 ],
 "active_techniques": [
  "step",
  "retreat",
  "pivot",
  "feint",
  "cut_kick",
  "fast_roundhouse",
  "instep_head_kick",
  "side_kick",
  "spinning_back_kick",
  "switch_step",
  "double_roundhouse",
  "tornado_kick",
  "jumping_back_kick",
  "clinch_break",
  "bounce_step",
  "sprawl",
  "whizzer"
 ],
 "signature_moves": [
  "cut_kick",
  "tornado_kick",
  "fast_roundhouse"
 ],
 "airborne_training": {
  "allowed_vertical_modes": [
   "grounded",
   "athletic"
  ],
  "techniques": [
   "double_roundhouse",
   "tornado_kick",
   "jumping_back_kick"
  ]
 },
 "conditional_abilities": [],
 "combat_limitations": [
  "Template card for Taekwondo: replace with the character's own limitations."
 ],
 "fighting_description": {
  "does": "Long-range kicking: cut kicks to stop entries, fast roundhouses, head kicks.",
  "wins": "By the style's signature tools (see signature_moves).",
  "avoids": "Fighting outside its home range.",
  "beaten_by": "Opponents who exploit its listed seams."
 },
 "appearance": {
  "clothing": "TBD",
  "identity_anchor": "TBD",
  "props": []
 },
 "provenance": {
  "classification": "CANON",
  "note": "style template from the v2.1 handoff; rename and customize before use"
 }
}
