{
 "version": "block-2",
 "fighter_id": "donnell",
 "name": "Donnell",
 "combat_identity": "Forward-loaded pressure boxer",
 "dimensions": {
  "hands": "hands.peekaboo",
  "defense": "defense.slip_roll",
  "stance": "stance.crouch",
  "tie": null,
  "target": "target.head_hunter",
  "kicking": "kicking.none",
  "mentality": "mentality.pressure"
 },
 "adaptation": "mma",
 "orientation": "orthodox",
 "slot_count": 3,
 "slot_label": "Triad",
 "synchronized_capabilities": [
  {
   "id": "donnell.slot.1",
   "capabilities": [
    "boxing"
   ],
   "description": "Trained synchronized bundle: boxing",
   "trigger": "fight_start",
   "sequence": [
    "jab",
    "cross",
    "hook",
    "body_hook",
    "uppercut"
   ],
   "home_range": "punch",
   "goal": "head_damage",
   "abandon_rule": {
    "max_consecutive_stalls": 2,
    "condition": "sequence_denied_or_countered"
   },
   "links": [
    "donnell.slot.2"
   ]
  },
  {
   "id": "donnell.slot.2",
   "capabilities": [
    "boxing",
    "pressure_footwork"
   ],
   "description": "Coordinate forward steps with a recovered high cover.",
   "trigger": "opponent_circles_out",
   "sequence": [
    "cut_off_step",
    "body_jab",
    "hook",
    "rear_hook",
    "body_hook"
   ],
   "home_range": "punch",
   "goal": "wall_pressure",
   "abandon_rule": {
    "max_consecutive_stalls": 2,
    "condition": "sequence_denied_or_countered"
   },
   "links": [
    "donnell.slot.3",
    "donnell.slot.1"
   ]
  },
  {
   "id": "donnell.slot.3",
   "capabilities": [
    "inside_combinations"
   ],
   "description": "Coordinate a short hook after a shallow slip without changing the forward-loaded base.",
   "trigger": "close_range_reached",
   "sequence": [
    "shovel_hook",
    "short_uppercut"
   ],
   "home_range": "close",
   "goal": "head_damage",
   "abandon_rule": {
    "max_consecutive_stalls": 2,
    "condition": "pocket_stalled"
   },
   "links": [
    "donnell.slot.1"
   ]
  }
 ],
 "baseline_capabilities": [
  "basic_movement",
  "untrained_striking"
 ],
 "tempo": 4,
 "preferred_ranges": [
  "close",
  "punch"
 ],
 "debt_sentence": "Crowd the reset with a compact hook; lead-leg loading and absent tie training give opponents entries.",
 "exploitable_seams": [
  "debt.hands.peekaboo.leg",
  "debt.hands.peekaboo.vision",
  "debt.defense.slip_roll.head_uppercut",
  "debt.defense.slip_roll.clinch",
  "debt.defense.slip_roll.leg",
  "debt.stance.crouch.leg",
  "debt.stance.crouch.head_uppercut",
  "debt.target.head_hunter.body",
  "debt.target.head_hunter.entry",
  "debt.kicking.none.leg",
  "debt.kicking.none.body",
  "debt.mentality.pressure.angle",
  "debt.mentality.pressure.body"
 ],
 "active_techniques": [
  "step",
  "retreat",
  "pivot",
  "feint",
  "jab",
  "cross",
  "hook",
  "body_hook",
  "uppercut",
  "haymaker",
  "parry",
  "shell_block",
  "slip",
  "cut_off_step",
  "body_jab",
  "rear_hook",
  "shovel_hook",
  "short_uppercut"
 ],
 "conditional_abilities": [],
 "combat_limitations": [
  "Only listed trained capabilities are available.",
  "A NULL tie is untrained attachment, not intentional anti-grappling."
 ],
 "fighting_description": {
  "does": "Crowd the reset with a compact hook.",
  "wins": "Reach close, punch and use Forward-loaded pressure boxer.",
  "avoids": "Unrecovered support and opponent control of the next range.",
  "beaten_by": "lead-leg loading and absent tie training give opponents entries."
 },
 "appearance": {
  "clothing": "cobalt shorts",
  "identity_anchor": "Donnell / Forward-loaded pressure boxer",
  "props": []
 },
 "provenance": {
  "classification": "CANON",
  "label": "[CANON]",
  "source": "Supplied mandatory identity where specified; all other details authored for this release."
 },
 "signature_moves": [
  "hook",
  "cross",
  "body_hook"
 ],
 "airborne_training": {
  "allowed_vertical_modes": [
   "grounded"
  ],
  "techniques": []
 },
 "revision": 1
}
