{
 "version": "block-2",
 "revision": 1,
 "fighter_id": "tpl_capoeira",
 "name": "Capoeira template",
 "combat_identity": "Capoeira starter build (rename and customize)",
 "dimensions": {
  "hands": "hands.hands_down",
  "defense": "defense.slip_roll",
  "stance": "stance.shuffle",
  "tie": null,
  "target": "target.head_hunter",
  "kicking": "kicking.karate",
  "mentality": "mentality.showman"
 },
 "adaptation": "mma",
 "orientation": "orthodox",
 "slot_count": 2,
 "slot_label": "Two-piece",
 "synchronized_capabilities": [
  {
   "id": "tpl_capoeira.slot.1",
   "capabilities": [
    "capoeira"
   ],
   "description": "Ginga hides the timing; round, crescent and spinning kicks at head height.",
   "trigger": "fight_start",
   "sequence": [
    "ginga",
    "martelo",
    "queixada",
    "armada",
    "meia_lua_de_compasso"
   ],
   "home_range": "kick",
   "goal": "head_damage",
   "abandon_rule": {
    "max_consecutive_stalls": 2,
    "condition": "kicks_blocked_or_jammed"
   },
   "links": [
    "tpl_capoeira.slot.2"
   ]
  },
  {
   "id": "tpl_capoeira.slot.2",
   "capabilities": [
    "capoeira",
    "acrobatics"
   ],
   "description": "Evades low, sweeps the standing leg, cartwheels out of corners.",
   "trigger": "opponent_commits",
   "sequence": [
    "bencao",
    "rasteira",
    "au",
    "cartwheel_kick"
   ],
   "home_range": "kick",
   "goal": "counter_trap",
   "abandon_rule": {
    "max_consecutive_stalls": 2,
    "condition": "sequence_denied_or_countered"
   },
   "links": [
    "tpl_capoeira.slot.1"
   ]
  }
 ],
 "baseline_capabilities": [
  "basic_movement",
  "untrained_striking"
 ],
 "tempo": 3,
 "preferred_ranges": [
  "kick"
 ],
 "debt_sentence": "Capoeira template: every option's weakness is listed in exploitable_seams.",
 "exploitable_seams": [
  "debt.defense.slip_roll.clinch",
  "debt.defense.slip_roll.head_uppercut",
  "debt.defense.slip_roll.leg",
  "debt.hands.hands_down.head_hook",
  "debt.hands.hands_down.head_straight",
  "debt.kicking.karate.leg",
  "debt.kicking.karate.single_support",
  "debt.mentality.showman.head_hook",
  "debt.mentality.showman.head_straight",
  "debt.stance.shuffle.single_support",
  "debt.stance.shuffle.tempo",
  "debt.target.head_hunter.body",
  "debt.target.head_hunter.entry"
 ],
 "active_techniques": [
  "step",
  "retreat",
  "pivot",
  "feint",
  "ginga",
  "martelo",
  "queixada",
  "armada",
  "meia_lua_de_compasso",
  "bencao",
  "rasteira",
  "au",
  "cartwheel_kick",
  "esquiva",
  "negativa",
  "side_kick",
  "headbutt"
 ],
 "signature_moves": [
  "meia_lua_de_compasso",
  "rasteira",
  "armada"
 ],
 "airborne_training": {
  "allowed_vertical_modes": [
   "grounded",
   "athletic",
   "aerial"
  ],
  "techniques": [
   "au",
   "cartwheel_kick"
  ]
 },
 "conditional_abilities": [],
 "combat_limitations": [
  "Template card for Capoeira: replace with the character's own limitations."
 ],
 "fighting_description": {
  "does": "Ginga hides the timing; round, crescent and spinning kicks at head height.",
  "wins": "By the style's signature tools (see signature_moves).",
  "avoids": "Fighting outside its home range.",
  "beaten_by": "Opponents who exploit its listed seams."
 },
 "appearance": {
  "clothing": "TBD",
  "identity_anchor": "TBD",
  "props": []
 },
 "provenance": {
  "classification": "CANON",
  "note": "style template from the v2.1 handoff; rename and customize before use"
 }
}
