{
 "version": "block-2",
 "revision": 1,
 "fighter_id": "tpl_shuai_jiao",
 "name": "Shuai Jiao template",
 "combat_identity": "Shuai Jiao starter build (rename and customize)",
 "dimensions": {
  "hands": "hands.high_guard",
  "defense": "defense.parry_catch",
  "stance": "stance.balanced",
  "tie": "tie.judo_sambo",
  "target": "target.mixer",
  "kicking": "kicking.sanda",
  "mentality": "mentality.technician"
 },
 "adaptation": "mma",
 "orientation": "orthodox",
 "slot_count": 2,
 "slot_label": "Two-piece",
 "synchronized_capabilities": [
  {
   "id": "tpl_shuai_jiao.slot.1",
   "capabilities": [
    "shuai_jiao"
   ],
   "description": "Grip and throw in one beat, stay on the feet.",
   "trigger": "fight_start",
   "sequence": [
    "quick_grip_throw",
    "kick_into_throw",
    "outside_trip",
    "inside_trip",
    "hip_throw"
   ],
   "home_range": "clinch",
   "goal": "position",
   "abandon_rule": {
    "max_consecutive_stalls": 2,
    "condition": "clinch_denied_or_escaped"
   },
   "links": [
    "tpl_shuai_jiao.slot.2"
   ]
  },
  {
   "id": "tpl_shuai_jiao.slot.2",
   "capabilities": [
    "sanda"
   ],
   "description": "Sanda kicks to draw the catch and the throw.",
   "trigger": "slot_stalled",
   "sequence": [
    "side_kick",
    "low_kick",
    "body_kick",
    "teep"
   ],
   "home_range": "kick",
   "goal": "leg_attrition",
   "abandon_rule": {
    "max_consecutive_stalls": 2,
    "condition": "kicks_blocked_or_jammed"
   },
   "links": [
    "tpl_shuai_jiao.slot.1"
   ]
  }
 ],
 "baseline_capabilities": [
  "basic_movement",
  "untrained_striking"
 ],
 "tempo": 3,
 "preferred_ranges": [
  "clinch",
  "kick"
 ],
 "debt_sentence": "Shuai Jiao template: every option's weakness is listed in exploitable_seams.",
 "exploitable_seams": [
  "debt.defense.parry_catch.body",
  "debt.defense.parry_catch.head_hook",
  "debt.hands.high_guard.body",
  "debt.hands.high_guard.vision",
  "debt.kicking.sanda.head_straight",
  "debt.kicking.sanda.recovery",
  "debt.mentality.technician.clinch",
  "debt.mentality.technician.wall",
  "debt.stance.balanced.head_straight",
  "debt.stance.balanced.tempo",
  "debt.target.mixer.recovery",
  "debt.target.mixer.tempo",
  "debt.tie.judo_sambo.ground",
  "debt.tie.judo_sambo.tempo"
 ],
 "active_techniques": [
  "step",
  "retreat",
  "pivot",
  "feint",
  "quick_grip_throw",
  "kick_into_throw",
  "outside_trip",
  "inside_trip",
  "hip_throw",
  "side_kick",
  "low_kick",
  "body_kick",
  "teep",
  "kick_catch",
  "caught_kick_dump",
  "sanda_sweep",
  "collar_tie",
  "jab",
  "parry"
 ],
 "signature_moves": [
  "quick_grip_throw",
  "kick_into_throw"
 ],
 "airborne_training": {
  "allowed_vertical_modes": [
   "grounded"
  ],
  "techniques": []
 },
 "conditional_abilities": [],
 "combat_limitations": [
  "Template card for Shuai Jiao: replace with the character's own limitations."
 ],
 "fighting_description": {
  "does": "Grip and throw in one beat, stay on the feet.",
  "wins": "By the style's signature tools (see signature_moves).",
  "avoids": "Fighting outside its home range.",
  "beaten_by": "Opponents who exploit its listed seams."
 },
 "appearance": {
  "clothing": "TBD",
  "identity_anchor": "TBD",
  "props": []
 },
 "provenance": {
  "classification": "CANON",
  "note": "style template from the v2.1 handoff; rename and customize before use"
 }
}
